{
  "schema": "dac_golden_cases@1.1",
  "engine": "dac/core v6 (L ⊆ DEF ⊆ U), verdict_map + obligations + simulation",
  "note": "expect は部分集合一致。application ケースは rulepack_ref で実パックを解決し、obligations/simulation も検査できる。structure ケースは inline_rulepack（verdict_map なし＝後方互換 concl 規約）。",
  "cases": [
    {
      "id": "gc_app_profiling_reinstates_high_risk",
      "kind": "application",
      "rulepack_ref": "eu_ai_act_art6",
      "facts": {
        "ai_system": { "value": true, "confidence": "confirmed" },
        "usecase": { "value": "5(b)", "confidence": "confirmed" },
        "permitted_by_law": { "value": true, "confidence": "confirmed" },
        "filter_c": { "value": true, "confidence": "confirmed" },
        "automated": { "value": true, "confidence": "confirmed" },
        "personal_data": { "value": true, "confidence": "confirmed" },
        "evaluate_aspects": { "value": true, "confidence": "confirmed" },
        "role_provider": { "value": true, "confidence": "confirmed" }
      },
      "expect": {
        "verdict": "HIGH_RISK", "provisional": false,
        "band4": { "high_risk@pathB": "ESTABLISHED", "not_high_risk": "EXCLUDED" },
        "accepted_rules": ["rB", "eProf"], "rejected_rules": ["rFilt"], "invariant": true,
        "obligations": { "triggered": true, "role": "provider", "includes": ["obl_art9", "obl_art43", "obl_art49"], "minCount": 13 }
      }
    },
    {
      "id": "gc_app_filter_exempt_not_high_risk",
      "kind": "application",
      "rulepack_ref": "eu_ai_act_art6",
      "facts": {
        "ai_system": { "value": true, "confidence": "confirmed" },
        "usecase": { "value": "4(b)", "confidence": "confirmed" },
        "permitted_by_law": { "value": true, "confidence": "confirmed" },
        "filter_a": { "value": true, "confidence": "confirmed" }
      },
      "expect": {
        "verdict": "NOT_HIGH_RISK",
        "band4": { "high_risk@pathB": "EXCLUDED", "not_high_risk": "ESTABLISHED" },
        "accepted_rules": ["rFilt"], "rejected_rules": ["rB"], "invariant": true,
        "obligations": { "triggered": false }
      }
    },
    {
      "id": "gc_app_pathA_filter_immunity",
      "kind": "application",
      "rulepack_ref": "eu_ai_act_art6",
      "facts": {
        "ai_system": { "value": true, "confidence": "confirmed" },
        "annexI_regulated": { "value": true, "confidence": "confirmed" },
        "product_itself": { "value": true, "confidence": "confirmed" },
        "third_party_ca": { "value": true, "confidence": "confirmed" },
        "usecase": { "value": "4(b)", "confidence": "confirmed" },
        "permitted_by_law": { "value": true, "confidence": "confirmed" },
        "filter_a": { "value": true, "confidence": "confirmed" }
      },
      "expect": {
        "verdict": "HIGH_RISK",
        "band4": { "high_risk@pathA": "ESTABLISHED", "high_risk@pathB": "EXCLUDED", "not_high_risk": "ESTABLISHED" },
        "accepted_rules": ["sA", "rFilt"], "invariant": true,
        "obligations": { "triggered": true, "minCount": 13 }
      }
    },
    {
      "id": "gc_app_provisional_on_presumed",
      "kind": "application",
      "rulepack_ref": "eu_ai_act_art6",
      "facts": {
        "ai_system": { "value": true, "confidence": "confirmed" },
        "usecase": { "value": "5(b)", "confidence": "confirmed" },
        "permitted_by_law": { "value": true, "confidence": "presumed" },
        "filter_c": { "value": true, "confidence": "confirmed" },
        "automated": { "value": true, "confidence": "confirmed" },
        "personal_data": { "value": true, "confidence": "confirmed" },
        "evaluate_aspects": { "value": true, "confidence": "confirmed" }
      },
      "expect": {
        "verdict": "HIGH_RISK", "provisional": true,
        "band4": { "high_risk@pathB": "ESTABLISHED" },
        "open_literals": ["permitted_by_law"], "invariant": true,
        "obligations": { "triggered": true, "provisional": true, "roleAssumed": true }
      }
    },
    {
      "id": "gc_app_simulation_flips_verdict",
      "kind": "application",
      "rulepack_ref": "eu_ai_act_art6",
      "facts": {
        "ai_system": { "value": true, "confidence": "confirmed" },
        "usecase": { "value": "4(b)", "confidence": "confirmed" },
        "permitted_by_law": { "value": true, "confidence": "confirmed" },
        "filter_a": { "value": true, "confidence": "presumed" }
      },
      "expect": {
        "verdict": "NOT_HIGH_RISK",
        "obligations": { "triggered": false },
        "simulation": { "verdictFlipsTo": "HIGH_RISK", "flipLiteralsInclude": ["ranks_or_scores"] }
      }
    },
    {
      "id": "gc_cra_classII_third_party",
      "kind": "application",
      "rulepack_ref": "cra",
      "facts": {
        "product_digital_elements": { "value": true, "confidence": "confirmed" },
        "data_connection": { "value": true, "confidence": "confirmed" },
        "annexIII_classII": { "value": true, "confidence": "confirmed" }
      },
      "expect": {
        "verdict": "IN_SCOPE",
        "band4": { "in_scope": "ESTABLISHED", "tier_class_II": "ESTABLISHED", "tier_default": "EXCLUDED" },
        "accepted_rules": ["rScope", "rClassII"], "rejected_rules": ["rDefault"], "invariant": true,
        "obligations": { "triggered": true, "includes": ["obl_essential_req", "obl_ca_classII"], "minCount": 8 }
      }
    },
    {
      "id": "gc_cra_critical_priority_over_classII",
      "kind": "application",
      "rulepack_ref": "cra",
      "facts": {
        "product_digital_elements": { "value": true, "confidence": "confirmed" },
        "data_connection": { "value": true, "confidence": "confirmed" },
        "annexIII_classII": { "value": true, "confidence": "confirmed" },
        "annexIV_critical": { "value": true, "confidence": "confirmed" }
      },
      "expect": {
        "verdict": "IN_SCOPE",
        "band4": { "tier_critical": "ESTABLISHED", "tier_class_II": "EXCLUDED", "tier_default": "EXCLUDED" },
        "accepted_rules": ["rCritical"], "rejected_rules": ["rClassII", "rDefault"], "invariant": true,
        "obligations": { "triggered": true, "includes": ["obl_ca_critical"] }
      }
    },
    {
      "id": "gc_cra_excluded_out_of_scope",
      "kind": "application",
      "rulepack_ref": "cra",
      "facts": {
        "product_digital_elements": { "value": true, "confidence": "confirmed" },
        "data_connection": { "value": true, "confidence": "confirmed" },
        "excluded_other_regulation": { "value": true, "confidence": "confirmed" }
      },
      "expect": {
        "verdict": "OUT_OF_SCOPE",
        "band4": { "in_scope": "EXCLUDED", "out_of_scope": "ESTABLISHED", "tier_default": "EXCLUDED" },
        "accepted_rules": ["rExcl"], "rejected_rules": ["rScope", "rDefault"], "invariant": true,
        "obligations": { "triggered": false }
      }
    },
    {
      "id": "gc_cra_simulation_excluded_flips",
      "kind": "application",
      "rulepack_ref": "cra",
      "facts": {
        "product_digital_elements": { "value": true, "confidence": "confirmed" },
        "data_connection": { "value": true, "confidence": "confirmed" }
      },
      "expect": {
        "verdict": "IN_SCOPE",
        "obligations": { "triggered": true, "minCount": 8 },
        "simulation": { "verdictFlipsTo": "OUT_OF_SCOPE", "flipLiteralsInclude": ["excluded_other_regulation"] }
      }
    },
    {
      "id": "gc_gdpr_35_3a_required_with_consultation",
      "kind": "application",
      "rulepack_ref": "gdpr_art35",
      "facts": {
        "systematic_extensive_evaluation": { "value": true, "confidence": "confirmed" },
        "residual_high_risk": { "value": true, "confidence": "confirmed" }
      },
      "expect": {
        "verdict": "DPIA_REQUIRED",
        "band4": { "dpia_required": "ESTABLISHED", "prior_consultation_required": "ESTABLISHED" },
        "accepted_rules": ["r35_3a", "r36"], "invariant": true,
        "obligations": { "triggered": true, "includes": ["obl_carry_out_dpia", "obl_prior_consultation"], "minCount": 4 }
      }
    },
    {
      "id": "gc_gdpr_whitelist_exempts",
      "kind": "application",
      "rulepack_ref": "gdpr_art35",
      "facts": {
        "high_risk_likely": { "value": true, "confidence": "confirmed" },
        "authority_whitelist": { "value": true, "confidence": "confirmed" }
      },
      "expect": {
        "verdict": "DPIA_NOT_REQUIRED",
        "band4": { "dpia_required": "EXCLUDED", "dpia_not_required": "ESTABLISHED" },
        "accepted_rules": ["r35_5"], "rejected_rules": ["r35_1"], "invariant": true,
        "obligations": { "triggered": false }
      }
    },
    {
      "id": "gc_gdpr_blacklist_reinstates_over_whitelist",
      "kind": "application",
      "rulepack_ref": "gdpr_art35",
      "facts": {
        "high_risk_likely": { "value": true, "confidence": "confirmed" },
        "authority_whitelist": { "value": true, "confidence": "confirmed" },
        "authority_blacklist": { "value": true, "confidence": "confirmed" }
      },
      "expect": {
        "verdict": "DPIA_REQUIRED",
        "band4": { "dpia_required": "ESTABLISHED", "dpia_not_required": "EXCLUDED" },
        "accepted_rules": ["r35_4"], "rejected_rules": ["r35_5"], "invariant": true,
        "obligations": { "triggered": true }
      }
    },
    {
      "id": "gc_gdpr_legalbasis_exempts",
      "kind": "application",
      "rulepack_ref": "gdpr_art35",
      "facts": {
        "systematic_extensive_evaluation": { "value": true, "confidence": "confirmed" },
        "legal_basis_law": { "value": true, "confidence": "confirmed" },
        "dpia_done_in_legislation": { "value": true, "confidence": "confirmed" }
      },
      "expect": {
        "verdict": "DPIA_NOT_REQUIRED",
        "labels": { "r35_10": "IN", "r35_3a": "OUT" },
        "band4": { "dpia_not_required": "ESTABLISHED" },
        "accepted_rules": ["r35_10"], "rejected_rules": ["r35_3a"], "invariant": true,
        "obligations": { "triggered": false }
      }
    },
    {